{
    "categories": [
        {
            "name": "Seguridad"
        }
    ],
    "items": [
        {
            "category": "Seguridad",
            "description": "Azure Event Hub proporciona cifrado de datos en reposo. Si usa su propia clave, los datos aún se cifran con la clave administrada por Microsoft, pero además la clave administrada por Microsoft se cifrará con la clave administrada por el cliente. ",
            "guid": "7aaf12e7-b94e-4f6e-847d-2d92981b1cd6",
            "link": "https://learn.microsoft.com/azure/event-hubs/configure-customer-managed-key",
            "severity": "Bajo",
            "subcategory": "Protección de datos",
            "text": "Usar la opción de clave administrada por el cliente en el cifrado de datos en reposo cuando sea necesario",
            "training": "https://docs.microsoft.com/learn/modules/plan-implement-administer-conditional-access/"
        },
        {
            "category": "Seguridad",
            "description": "Los espacios de nombres de Azure Event Hubs permiten a los clientes enviar y recibir datos con TLS 1.0 y versiones posteriores. Para aplicar medidas de seguridad más estrictas, puede configurar el espacio de nombres de Centros de eventos para que requiera que los clientes envíen y reciban datos con una versión más reciente de TLS. Si un espacio de nombres de Centros de eventos requiere una versión mínima de TLS, se producirá un error en las solicitudes realizadas con una versión anterior. ",
            "guid": "d2f54b29-769e-43a6-a0e7-828ac936657e",
            "link": "https://learn.microsoft.com/azure/event-hubs/transport-layer-security-configure-minimum-version",
            "severity": "Medio",
            "subcategory": "Protección de datos",
            "text": "Aplicar una versión mínima requerida de Seguridad de la capa de transporte (TLS) para las solicitudes ",
            "training": "https://docs.microsoft.com/learn/modules/secure-aad-users-with-mfa/"
        },
        {
            "category": "Seguridad",
            "description": "Al crear un espacio de nombres de Centros de eventos, se crea automáticamente una regla de directiva denominada RootManageSharedAccessKey para el espacio de nombres. Esta directiva tiene permisos de administración para todo el espacio de nombres. Se recomienda tratar esta regla como una cuenta raíz administrativa y no usarla en la aplicación. Se recomienda usar AAD como proveedor de autenticación con RBAC. ",
            "guid": "13b0f566-4b1e-4944-a459-837ee79d6c6d",
            "link": "https://learn.microsoft.com/azure/event-hubs/authorize-access-shared-access-signature#shared-access-authorization-policies",
            "severity": "Medio",
            "subcategory": "Gestión de identidades y accesos",
            "text": "Evite usar una cuenta root cuando no sea necesario",
            "training": "https://docs.microsoft.com/learn/paths/azure-administrator-manage-identities-governance/"
        },
        {
            "category": "Seguridad",
            "description": "Las identidades administradas para los recursos de Azure pueden autorizar el acceso a los recursos de Centros de eventos mediante credenciales de Azure AD desde aplicaciones que se ejecutan en máquinas virtuales (VM), aplicaciones de función, conjuntos de escalado de máquinas virtuales y otros servicios. Mediante el uso de identidades administradas para recursos de Azure junto con la autenticación de Azure AD, puede evitar almacenar credenciales con las aplicaciones que se ejecutan en la nube. ",
            "guid": "3a365a5c-7acb-4e48-abd5-4cd79f2e8776",
            "link": "https://learn.microsoft.com/azure/event-hubs/authenticate-managed-identity?tabs=latest",
            "severity": "Medio",
            "subcategory": "Gestión de identidades y accesos",
            "text": "Siempre que sea posible, la aplicación debe usar una identidad administrada para autenticarse en Azure Event Hub. Si no es así, considere la posibilidad de tener la credencial de almacenamiento (SAS, credencial de entidad de servicio) en Azure Key Vault o un servicio equivalente",
            "training": "https://docs.microsoft.com/learn/modules/azure-ad-privileged-identity-management/"
        },
        {
            "category": "Seguridad",
            "description": "Al crear permisos, proporcione un control detallado sobre el acceso de un cliente a Azure Event Hub. Los permisos en Azure Event Hub pueden y deben limitarse al nivel de recurso individual, por ejemplo, grupo de consumidores, entidad de centro de eventos, espacios de nombres de centros de eventos, etc.",
            "guid": "8357c559-675c-45ee-a5b8-6ad8844ce3b2",
            "link": "https://learn.microsoft.com/azure/event-hubs/authorize-access-azure-active-directory#azure-built-in-roles-for-azure-event-hubs",
            "severity": "Alto",
            "subcategory": "Gestión de identidades y accesos",
            "text": "Usar RBAC del plano de datos con privilegios mínimos",
            "training": "https://docs.microsoft.com/learn/modules/explore-basic-services-identity-types/"
        },
        {
            "category": "Seguridad",
            "description": "Los registros de recursos de Azure Event Hub incluyen registros operativos, registros de red virtual y registros de Kafka. Los registros de auditoría en tiempo de ejecución capturan información de diagnóstico agregada para todas las operaciones de acceso al plano de datos (como eventos de envío o recepción) en Centros de eventos.",
            "guid": "b38b875b-a1cf-4104-a900-3a4d3ce474db",
            "link": "https://learn.microsoft.com/azure/event-hubs/monitor-event-hubs-reference",
            "severity": "Medio",
            "subcategory": "Monitorización",
            "text": "Habilite el registro para la investigación de seguridad. Use Azure Monitor para capturar métricas y registros, como registros de recursos, registros de auditoría en tiempo de ejecución y registros de Kafka",
            "training": "https://docs.microsoft.com/learn/paths/manage-identity-and-access/"
        },
        {
            "category": "Seguridad",
            "description": "De forma predeterminada, Azure Event Hub tiene una dirección IP pública y es accesible desde Internet. Los puntos de conexión privados permiten que el tráfico entre la red virtual y Azure Event Hub atraviese la red troncal de Microsoft. Además de eso, debe deshabilitar los puntos finales públicos si no se usan. ",
            "guid": "5abca2a4-eda1-4dae-8cc9-5d48c6b791dc",
            "link": "https://learn.microsoft.com/azure/event-hubs/private-link-service",
            "severity": "Medio",
            "subcategory": "Gestión de redes",
            "text": "Considere la posibilidad de usar puntos de conexión privados para acceder a Azure Event Hub y deshabilitar el acceso a la red pública cuando corresponda.",
            "training": "https://docs.microsoft.com/learn/modules/azure-ad-privileged-identity-management/"
        },
        {
            "category": "Seguridad",
            "description": "Con el firewall IP, puede restringir el punto final público a solo un conjunto de direcciones IPv4 o rangos de direcciones IPv4 en notación CIDR (enrutamiento entre dominios sin clases). ",
            "guid": "a0e6c465-89e5-458b-a37d-3974d1112dbd",
            "link": "https://learn.microsoft.com/azure/event-hubs/event-hubs-ip-filtering",
            "severity": "Medio",
            "subcategory": "Gestión de redes",
            "text": "Considere la posibilidad de permitir solo el acceso al espacio de nombres de Azure Event Hub desde direcciones IP o intervalos específicos",
            "training": "https://docs.microsoft.com/learn/paths/implement-resource-mgmt-security/"
        }
    ],
    "metadata": {
        "name": "Azure Event Hub Review",
        "state": "Preview"
    },
    "severities": [
        {
            "name": "Alto"
        },
        {
            "name": "Medio"
        },
        {
            "name": "Bajo"
        }
    ],
    "status": [
        {
            "description": "Esta comprobación aún no se ha examinado",
            "name": "No verificado"
        },
        {
            "description": "Hay un elemento de acción asociado a esta comprobación",
            "name": "Abrir"
        },
        {
            "description": "Esta comprobación se ha comprobado y no hay más elementos de acción asociados a ella",
            "name": "Cumplido"
        },
        {
            "description": "Recomendación entendida, pero no necesaria por los requisitos actuales",
            "name": "No es necesario"
        },
        {
            "description": "No aplicable para el diseño actual",
            "name": "N/A"
        }
    ]
}